id;scientific_title;date;journal
NCT01967433;Use of Diphenhydramine as an Adjunctive Sedative for Colonoscopy in Patients Chronically on Opioids;1-1-2020;Journal of emergency nursing
NCT04189588;Phase 2 Study IV QUZYTTIR™ (Cetirizine Hydrochloride Injection) vs V Diphenhydramine;1-1-2020;Journal of emergency nursing
NCT04237090;  ;1-1-2020;Journal of emergency nursing
NCT04237091;Feasibility of a Randomized Controlled Clinical Trial Comparing the Use of Cetirizine to Replace Diphenhydramine in the Prevention of Reactions Related to Paclitaxel;1-1-2020;Journal of emergency nursing
NCT04153396;Preemptive Infiltration With Betamethasone and Ropivacaine for Postoperative Pain in Laminoplasty or \xc3\xb1 Laminectomy;1-1-2020;Hôpitaux Universitaires de Genève
NCT04188184;Tranexamic Acid Versus Epinephrine During Exploratory Tympanotomy;27-4-2020;Journal of emergency nursing\xc3\x28
